{
  "schema": "mercy.ac.catalog",
  "schemaVersion": "1.0.0",
  "catalog": {
    "id": "example-from-builtin-package",
    "revision": 1,
    "generatedAt": "2026-10-09T00:00:00Z",
    "environment": "production"
  },
  "example": true,
  "notice": "EXAMPLE ONLY — derived from the launcher's built-in handoff package, NOT from live server configurations. Not verified. The launcher refuses any catalog carrying \"example\": true.",
  "servers": [
    {
      "id": "main",
      "displayName": "SRP Daishi PA",
      "engine": {
        "type": "kunos-stock"
      },
      "maxPlayers": 14,
      "ai": {
        "enabled": false,
        "trafficCars": 0
      },
      "connection": {
        "public": null,
        "ports": {
          "gamePort": 9600,
          "httpPort": 8081
        }
      },
      "tracks": [
        {
          "trackId": "shuto_revival_project_beta",
          "layouts": [
            "daishi_pa"
          ]
        }
      ],
      "cars": [
        {
          "carId": "art_nissan_gtr_bcnr33_600r",
          "role": "player",
          "required": true,
          "skins": [
            "3_Ultimate_Metal_Silver"
          ]
        },
        {
          "carId": "bksy_nissan_skyline_r34_vspec",
          "role": "player",
          "required": true,
          "skins": [
            "00_bayside_blue"
          ]
        },
        {
          "carId": "ddm_honda_civic_fd2",
          "role": "player",
          "required": true,
          "skins": [
            "00_championship_white"
          ]
        },
        {
          "carId": "ddm_nissan_skyline_bnr32",
          "role": "player",
          "required": true,
          "skins": [
            "1_crystal_white"
          ]
        },
        {
          "carId": "ddm_subaru_22b",
          "role": "player",
          "required": true,
          "skins": [
            "0_sonic_blue_mica"
          ]
        },
        {
          "carId": "naz_jza80_ridox_modern",
          "role": "player",
          "required": true,
          "skins": [
            "01_Soul_Red"
          ]
        },
        {
          "carId": "pear_nissan_silvia_s13_wangan",
          "role": "player",
          "required": true,
          "skins": [
            "Red"
          ]
        },
        {
          "carId": "rize_efini_rx7_fd3s_keisuke_1",
          "role": "player",
          "required": true,
          "skins": [
            "00_itsdraik_J9_Competition_Yellow_Mica"
          ]
        },
        {
          "carId": "sl_toyota_supra_mkiv_ridox",
          "role": "player",
          "required": true,
          "skins": [
            "01_scarlet_red"
          ]
        },
        {
          "carId": "srp_bcnr33_wangan",
          "role": "player",
          "required": true,
          "skins": [
            "1_GV1_Black_Pearl"
          ]
        },
        {
          "carId": "srp_honda_s2000_legendary",
          "role": "player",
          "required": true,
          "skins": [
            "Apex_Blue"
          ]
        },
        {
          "carId": "srp_toyota_supra_mkiv_interceptor",
          "role": "player",
          "required": true,
          "skins": [
            "ichiban"
          ]
        },
        {
          "carId": "wm_mazda_rx7_fd_rgo",
          "role": "player",
          "required": true,
          "skins": [
            "0_yellow_wmps3_anime"
          ]
        },
        {
          "carId": "wm_nissan_s15",
          "role": "player",
          "required": true,
          "skins": [
            "0_wmmt"
          ]
        }
      ],
      "requirements": {
        "csp": {
          "required": true,
          "minimumVersion": "0.1.76",
          "testedVersion": "0.2.11 b3465"
        }
      },
      "hud": {
        "delivery": "none",
        "version": "4.0.2"
      },
      "companionApps": []
    },
    {
      "id": "server2",
      "displayName": "SRP Traffic",
      "engine": {
        "type": "assettoserver"
      },
      "maxPlayers": 32,
      "ai": {
        "enabled": true,
        "trafficCars": 138
      },
      "connection": {
        "public": null,
        "ports": {
          "gamePort": 9650,
          "httpPort": 8090
        }
      },
      "tracks": [
        {
          "trackId": "shuto_revival_project_beta",
          "layouts": [
            "main_layout"
          ]
        }
      ],
      "cars": [
        {
          "carId": "art_nissan_gtr_bcnr33_600r",
          "role": "player",
          "required": true,
          "skins": [
            "3_Ultimate_Metal_Silver"
          ]
        },
        {
          "carId": "bati_e46_nspec54",
          "role": "player",
          "required": true,
          "skins": [
            "Alpinweiss III"
          ]
        },
        {
          "carId": "bksy_nissan_skyline_r34_vspec",
          "role": "player",
          "required": true,
          "skins": [
            "00_bayside_blue",
            "01_mnp3"
          ]
        },
        {
          "carId": "bmw_1m",
          "role": "player",
          "required": true
        },
        {
          "carId": "bmw_m3_e92",
          "role": "player",
          "required": true
        },
        {
          "carId": "ddm_honda_civic_fd2",
          "role": "player",
          "required": true,
          "skins": [
            "00_championship_white"
          ]
        },
        {
          "carId": "ddm_nissan_skyline_bnr32",
          "role": "player",
          "required": true,
          "skins": [
            "1_crystal_white",
            "2_spark_silver_metallic"
          ]
        },
        {
          "carId": "ddm_subaru_22b",
          "role": "player",
          "required": true,
          "skins": [
            "0_sonic_blue_mica"
          ]
        },
        {
          "carId": "gmp_e60_m5_f10style",
          "role": "player",
          "required": true,
          "skins": [
            "300_Alpine_White_III"
          ]
        },
        {
          "carId": "naz_jza80_ridox_modern",
          "role": "player",
          "required": true,
          "skins": [
            "01_Soul_Red",
            "02_Matte"
          ]
        },
        {
          "carId": "p3_mitsubishi_evo8",
          "role": "player",
          "required": true,
          "skins": [
            "00_cool_silver_met"
          ]
        },
        {
          "carId": "pear_nissan_silvia_s13_wangan",
          "role": "player",
          "required": true,
          "skins": [
            "Red",
            "Spark_Silver_Metallic"
          ]
        },
        {
          "carId": "rize_efini_rx7_fd3s_keisuke_1",
          "role": "player",
          "required": true,
          "skins": [
            "00_itsdraik_J9_Competition_Yellow_Mica",
            "01_itsdraik_M8_Montego_Blue_Metallic"
          ]
        },
        {
          "carId": "rize_traffic_mazda_rx8_se3p",
          "role": "traffic",
          "required": true,
          "skins": [
            "Brilliant Black",
            "Velocity Red Mica",
            "Winning Blue Metallic",
            "lightning yellow",
            "snowflake white pearl mica",
            "titanium gray metallic"
          ]
        },
        {
          "carId": "rize_traffic_toyota_celica_supra",
          "role": "traffic",
          "required": true,
          "skins": [
            "black",
            "red",
            "silver",
            "white"
          ]
        },
        {
          "carId": "rize_traffic_toyota_fj_cruiser",
          "role": "traffic",
          "required": true,
          "skins": [
            "Black",
            "Radiant Red",
            "Sun Fusion",
            "Voodoo Blue",
            "White"
          ]
        },
        {
          "carId": "sl_toyota_supra_mkiv_ridox",
          "role": "player",
          "required": true,
          "skins": [
            "01_scarlet_red",
            "02_jet_black"
          ]
        },
        {
          "carId": "srp_bcnr33_wangan",
          "role": "player",
          "required": true,
          "skins": [
            "1_GV1_Black_Pearl",
            "2_KR4_Sonic_Silver"
          ]
        },
        {
          "carId": "srp_honda_s2000_legendary",
          "role": "player",
          "required": true,
          "skins": [
            "Apex_Blue"
          ]
        },
        {
          "carId": "srp_mitsubishi_evo_5_kai",
          "role": "player",
          "required": true,
          "skins": [
            "00_scotia_white"
          ]
        },
        {
          "carId": "srp_toyota_supra_mkiv_interceptor",
          "role": "player",
          "required": true,
          "skins": [
            "ichiban",
            "niban"
          ]
        },
        {
          "carId": "traffic_aegis_airport_bus",
          "role": "traffic",
          "required": true,
          "skins": [
            "1",
            "2",
            "3",
            "4"
          ]
        },
        {
          "carId": "traffic_aegis_daihatsu_copen",
          "role": "traffic",
          "required": true,
          "skins": [
            "Black Mica Metallic",
            "Bright Silver Metallic",
            "Clear Blue Crystal Metallic",
            "Jaune Yellow",
            "Liquid Silver Metallic",
            "Matador Red Pearl"
          ]
        },
        {
          "carId": "traffic_aegis_izuzu_npr",
          "role": "traffic",
          "required": true,
          "skins": [
            "1",
            "2",
            "3",
            "4"
          ]
        },
        {
          "carId": "traffic_aegis_izuzu_npr_box",
          "role": "traffic",
          "required": true,
          "skins": [
            "1",
            "2",
            "3",
            "4"
          ]
        },
        {
          "carId": "traffic_aegis_mazda_cx3",
          "role": "traffic",
          "required": true,
          "skins": [